{"accepted_state_mtime":"2026-09-03T12:13:41Z","accepted_state_sha256":"ea60df74b120e17a95e6789ba1f9f0dea3de4761f2086cb81f11c77c64ea1313","canonical_repository_id":"dce8dbc3cde106047631317a09257c23ee5eab4d9ece5f88d52108ae384a8503","event":"natural-systemd-timer","expired_pending_entries":0,"local_completed_at":"2026-09-03T12:08:38Z","local_service_result":"success","nfs_snapshot_id":"5ae08ba6dbabe84592e8310db72750a81f64ebdef7245adfbd25d48a0d8d2805","pending_entries":0,"proton_completed_at":"2026-09-03T12:15:01Z","proton_copied_snapshots":1,"proton_service_result":"success","proton_snapshot_id":"1f19b4e39ac7781e20dce39493e5f508f0e33494c5d0ae6d5d5d135aeeeb6747","scheduled_local_time":"2026-09-03T05:00:00-07:00","source_snapshot_id":"149dc73ae8dca872fa807c60ab87eae5c29534cee15ebe3f51a643b7a00f7d50","version":1}
